"Title","Authors","Link","Year","Source title","Abstract","Author Keywords","Sponsors","Publisher","Conference name","Conference date","Conference location","Conference code","Document Type","Source"
"Improving early detection of software merge conflicts","GuimarÃ£es M.L., Silva A.R.","https://www.scopus.com/inward/record.uri?eid=2-s2.0-84864231591&doi=10.1109%2fICSE.2012.6227180&partnerID=40&md5=9ff2f7b5e249af74278063b114f15b71",2012,"Proceedings - International Conference on Software Engineering","Merge conflicts cause software defects which if detected late may require expensive resolution. This is especially true when developers work too long without integrating concurrent changes, which in practice is common as integration generally occurs at check-in. Awareness of others' activities was proposed to help developers detect conflicts earlier. However, it requires developers to detect conflicts by themselves and may overload them with notifications, thus making detection harder. This paper presents a novel solution that continuously merges uncommitted and committed changes to create a background system that is analyzed, compiled, and tested to precisely and accurately detect conflicts on behalf of developers, before check-in. An empirical study confirms that our solution avoids overloading developers and improves early detection of conflicts over existing approaches. Similarly to what happened with continuous compilation, this introduces the case for continuous merging inside the IDE. Â© 2012 IEEE.","awareness; continuous merging; merge conflicts; version control","IEEE Computer Society;ACM;University of Zurich (UZH), Department of Informatics;Technical Council on Software Engineering (TCSE);Special Interest Group on Software Engineering (SIGSOFT);SI-SE",,"34th International Conference on Software Engineering, ICSE 2012","2 June 2012 through 9 June 2012","Zurich",91326,"Conference Paper","Scopus"
"Test quality feedback improving effectivity and efficiency of unit testing","Perscheid M., Cassou D., Hirschfeld R.","https://www.scopus.com/inward/record.uri?eid=2-s2.0-84861213188&doi=10.1109%2fC5.2012.7&partnerID=40&md5=3a26fee28580d7a8de22c77ab27d841b",2012,"Proceedings - 10th International Conference on Creating, Connecting and Collaborating through Computing, C5 2012","Writing unit tests for a software system enhances the confidence that a system works as expected. Since time pressure often prevents a complete testing of all application details developers need to know which new tests the system requires. Developers also need to know which existing tests take the most time and slow down the whole development process. Missing feedback about less tested functionality and reasons for long running test cases make it, however, harder to create a test suite that covers all important parts of a software system in a minimum of time. As a result a software system may be inadequately tested and developers may test less frequently. Our approach provides test quality feedback to guide developers in identifying missing tests and correcting low-quality tests. We provide developers with a tool that analyzes test suites with respect to their effectivity (e.g., missing tests) and efficiency (e.g., time and memory consumption). We implement our approach, named Path Map, as an extended test runner within the Squeak Smalltalk IDE and demonstrate its benefits by improving the test quality of representative software systems. Â© 2012 IEEE.","Dynamic Analysis; Test Quality Feedback; Unit Tests","Kyoto University Global COE Program;Viewpoints Research Institute;USC Institute for Creative Technologies",,"10th International Conference on Creating, Connecting and Collaborating through Computing, C5 2012","18 January 2012 through 20 January 2012","Playa Vista, CA",89868,"Conference Paper","Scopus"
"Identifier-based context-dependent API method recommendation","Heinemann L., Bauer V., Herrmannsdoerfer M., Hummel B.","https://www.scopus.com/inward/record.uri?eid=2-s2.0-84860514537&doi=10.1109%2fCSMR.2012.14&partnerID=40&md5=497b9f412fdfcf599703e21aeb7a8f12",2012,"Proceedings of the European Conference on Software Maintenance and Reengineering, CSMR","Reuse recommendation systems support the developer by suggesting useful API methods, classes or code snippets based on code edited in the IDE. Existing systems based on structural information, such as type and method usage, are not effective in case of general purpose types such as String. To alleviate this, we propose a recommendation system based on identifiers that utilizes the developer's intention embodied in names of variables, types and methods. We investigate the impact of several variation points of our recommendation algorithm and evaluate the approach for recommending methods from the Java and Eclipse APIs in 9 open source systems. Furthermore, we compare our recommendations to those of a structure-based recommendation system and describe a metric for predicting the expected precision of a recommendation. Our findings indicate that our approach performs significantly better than the structure-based approach. Â© 2012 IEEE.","Data mining; Identifier; Recommendation system; Software reuse","Reengineering Forum (REF);University of Szeged;FrontEndART Software Ltd.",,"2012 16th European Conference on Software Maintenance and Reengineering, CSMR 2012","27 March 2012 through 30 March 2012","Szeged",89560,"Conference Paper","Scopus"
"Training of requirements analysis modeling with UML-based prototype generation tool","Ogata S., Matsuura S.","https://www.scopus.com/inward/record.uri?eid=2-s2.0-84858323898&doi=10.1145%2f2134254.2134273&partnerID=40&md5=d35b7f25489333a43dc9135766cd86af",2012,"Proceedings of the 5th India Software Engineering Conference, ISEC'12","To develop high quality software products efficiently, the requirements analysis is the most important phase in a software development process, but it is generally difficult to achieve the goal sufficiently. To master requirements analysis skills, the training of defining a desirable requirements specification should be conducted to the education at the university to train students to become high quality systems engineers. We have proposed a method of model-driven requirements analysis using Unified Modeling Language. Based on our requirement analysis method and the supporting tool, this paper proposes a way how to train the modeling ability of graduate students in our university. Â© 2012 ACM.","prototyping; training of requirements analysis; UML","IBM;Infosys;intel;Microsoft Research;SIEMENS",,"5th India Software Engineering Conference, ISEC 2012","22 February 2012 through 25 February 2012","Kanpur",89003,"Conference Paper","Scopus"
"How we refactor, and how we know it","Murphy-Hill E., Parnin C., Black A.P.","https://www.scopus.com/inward/record.uri?eid=2-s2.0-84856553512&doi=10.1109%2fTSE.2011.41&partnerID=40&md5=f8be859c4147bef9a7df678a1bdb5e77",2012,"IEEE Transactions on Software Engineering","Refactoring is widely practiced by developers, and considerable research and development effort has been invested in refactoring tools. However, little has been reported about the adoption of refactoring tools, and many assumptions about refactoring practice have little empirical support. In this paper, we examine refactoring tool usage and evaluate some of the assumptions made by other researchers. To measure tool usage, we randomly sampled code changes from four Eclipse and eight Mylyn developers and ascertained, for each refactoring, if it was performed manually or with tool support. We found that refactoring tools are seldom used: 11 percent by Eclipse developers and 9 percent by Mylyn developers. To understand refactoring practice at large, we drew from a variety of data sets spanning more than 39,000 developers, 240,000 tool-assisted refactorings, 2,500 developer hours, and 12,000 version control commits. Using these data, we cast doubt on several previously stated assumptions about how programmers refactor, while validating others. Finally, we interviewed the Eclipse and Mylyn developers to help us understand why they did not use refactoring tools and to gather ideas for future research. Â© 2006 IEEE.","floss refactoring; Refactoring; refactoring tools; root-canal refactoring",,,,,,,"Article","Scopus"
"Automated analysis of textual use-cases: Does NLP components and pipelines matter?","Kulkarni N., Parachuri D., Dasa M., Kumar A.","https://www.scopus.com/inward/record.uri?eid=2-s2.0-84874598904&doi=10.1109%2fAPSEC.2012.83&partnerID=40&md5=ee5b805b987467a013318947a7b7a2cf",2012,"Proceedings - Asia-Pacific Software Engineering Conference, APSEC","Significant time is spent by practitioners to analyze use-cases written in Natural Language (NL). With only prescriptive templates to describe complex scenarios, common errors like misinterpretation and oversight can have costly consequence later during system development. A semi-automatic approach based on NL processing can reduce the time spent on requirement analysis and bootstrap design activity. However, linguistic community has adopted pipeline processing to handle NL ambiguities where several sequential tasks aid in solving a bigger task. Choosing NL processing techniques depends on the domain and task to accomplish. As use-cases are domain specific it is crucial to identify suitable pipelines to process them. This is highlighted in our evaluation of two pipelines consisting of syntactic and semantic techniques on use-cases found in theory and practice. We believe, the promising results has opened up the need for exploring more task specific NLP pipelines and evaluation thereof. Â© 2012 IEEE.","Natural Language Processing; Requirement Engineering; Use Cases","ACM Hong Kong Chapter;IEEE Hong Kong Section Computer Society Chapter","IEEE Computer Society","19th Asia-Pacific Software Engineering Conference, APSEC 2012","4 December 2012 through 7 December 2012","Hong Kong",95873,"Conference Paper","Scopus"
"The Role of Visualization in Computer Science Education","Fouh E., Akbar M., Shaffer C.A.","https://www.scopus.com/inward/record.uri?eid=2-s2.0-84860123822&doi=10.1080%2f07380569.2012.651422&partnerID=40&md5=7173b08c163ba9a0755c20a055f98c25",2012,"Computers in the Schools","Computer science core instruction attempts to provide a detailed understanding of dynamic processes such as the working of an algorithm or the flow of information between computing entities. Such dynamic processes are not well explained by static media such as text and images, and are difficult to convey in lecture. The authors survey the history of visualization in computer science education, focusing on artifacts that have a documented positive educational assessment. Changes in how computing technology has affected the development and uptake of such visualization artifacts in computer science education, and how recent technology changes are leading to progress in developing online hypertextbooks are then discussed. Â© 2012 Taylor and Francis Group, LLC.","algorithm visualization; data structure visualization; eTextbooks; hypertextbooks; program visualization",,,,,,,"Article","Scopus"
"Search-based composition, streaming and playback of video archive content","Johansen D., Halvorsen P., Johansen H., Riiser H., Gurrin C., Olstad B., Griwodz C., Kvalnes A., Hurley J., Kupka T.","https://www.scopus.com/inward/record.uri?eid=2-s2.0-84883694471&doi=10.1007%2fs11042-011-0847-5&partnerID=40&md5=0ba1bc58a9739542448daecbf50e8934",2012,"Multimedia Tools and Applications","Locating content in existing video archives is both a time and bandwidth consuming process since users might have to download and manually watch large portions of superfluous videos. In this paper, we present two novel prototypes using an Internet based video composition and streaming system with a keyword-based search interface that collects, converts, analyses, indexes, and ranks video content. At user requests, the system can automatically sequence out portions of single videos or aggregate content from multiple videos to produce a single, personalized video stream on-the-fly. Â© The Author(s) 2011.","Personalized composition; Segmented adaptive HTTP streaming; Video search engines",,"Kluwer Academic Publishers",,,,,"Article","Scopus"
"GUI tools and generated code: Refactoring to reveal intent","Wainer M.","https://www.scopus.com/inward/record.uri?eid=2-s2.0-84871978553&partnerID=40&md5=2ac49db9f77a7761a66ea67b858019d4",2011,"Proceedings of the ISCA 26th International Conference on Computers and Their Applications, CATA 2011","High quality graphical user interfaces (GUIs), expected of today's applications, can be difficult and tedious to develop. Visual GUI build tools are helpful in this regard, providing a more direct approach to defining interface components than typical text based integrated development environments (IDE). These tools generate code which still must be integrated and maintained with the rest of the application code base. Generated code is observed to contain code smells, such as duplication, which mask the higher level intention of the design. Code refinement often accomplished through a traditional IDE, involve reverse engineering, modifications and refactoring (to evolve the design and remove code smells). As visual tools have improved, they are increasingly able to work with GUI code which has been refined elsewhere giving developers more options to mix tools as the project progresses. Refactorings specific to GUI tool generated code are considered through a focused example. To fully integrate the generated code into the code base, the higher level intent lost by the build tool should be reintroduced into the source code. This will generally be a multistep process which might be accomplished in a variety of ways. A new informal notation is introduced to assist developers in mapping out how to evolve their code to raise its abstraction level and make its intent more obvious. This is of special importance in agile development methodologies where the code itself is seen as the major expression of design. Copyright Â© 2011 by the International Society for Computers and Their Applications (ISCA).","Agile; Code smells; HCI; Refactoring; Reverse engineering; Software","Int. Soc. Comput. Their Appl. (ISCA)",,"26th International Conference on Computers and Their Applications, CATA 2011","23 March 2011 through 25 March 2011","New Orleans, LA",94796,"Article","Scopus"
"A two-stage service matching algorithm based on genetic algorithm","Wang B., Ma Y., Duan Y.","https://www.scopus.com/inward/record.uri?eid=2-s2.0-80052795442&partnerID=40&md5=0b53a63bbe153b06a2003d2cd41f8978",2011,"Journal of Computational Information Systems","Dynamic service composition is an important research area which aims at supporting reusability and interoperability for service composition. And service matching is one of the important steps. Completely intelligent service composition is extremely complicated. Therefore, many researches focus on local matching method. But this idea is usually not practical because the parameter and situation will be more complex in reality than in experiment. Others propose global service match algorithm which is effective, but they solve the problem just from QoS point of view which is not intelligent enough. This paper proposes a two-stage service match algorithm. In the first stage, we improved classic service semantic matching algorithm to match the interface parameter with service function. And then, genetic algorithm with multi-target and QoS constraints is used to global semantic match. Experiment show this method is available and effective. Â© 2005 by Binary Information Press.","Genetic algorithm; Service matching; Two-stage matching",,,,,,,"Article","Scopus"
"Recommending API methods based on identifier contexts","Heinemann L., Hummel B.","https://www.scopus.com/inward/record.uri?eid=2-s2.0-79960567215&doi=10.1145%2f1985429.1985430&partnerID=40&md5=a529fdbd6eca27b844fd2b42d4ecf728",2011,"Proceedings - International Conference on Software Engineering","Reuse recommendation systems suggest functions or code snippets that are useful for the programming task at hand within the IDE. These systems utilize different aspects from the context of the cursor position within the source file being edited for inferring which functionality is needed next. Current approaches are based on structural information like inheritance relations or type/method usages. We propose a novel method that utilizes the knowledge embodied in the identifiers as a basis for the recommendation of API methods. This approach has the advantage that relevant recommendations can also be made in cases where no methods are called in the context or if contexts use distinct but semantically similar types or methods. First experiments show, that the correct method is recommended in about one quarter to one third of the cases. Â© 2011 ACM.","recommendation system; software reuse","ACM SIGSOFT;IEEE CS",,"3rd International Workshop on Search-Driven Development: Users, Infrastructure, Tools, and Evaluation, SUITE 2011, Co-located with ICSE 2011","28 May 2011 through 28 May 2011","Waikiki, Honolulu, HI",85672,"Conference Paper","Scopus"
"SMaRT: A Workbench for reporting the monitorability of services from SLAs","Foster H., Spanoudakis G.","https://www.scopus.com/inward/record.uri?eid=2-s2.0-79959584701&doi=10.1145%2f1985394.1985400&partnerID=40&md5=523d8c236120892aafdfa018b5ae335c",2011,"Proceedings - International Conference on Software Engineering","Service Level Agreements (SLAs) for Software Services aim to clearly identify the service level commitments established between service requesters and providers. A dynamic configuration for the monitoring of these SLAs provides the opportunity for service monitor providers to offer and release monitoring infrastructures for different types of services. Whilst there has been work on automating this monitor matching and configuration, additional support may be needed in the negotiation and provision of monitors for which the current monitoring infrastructure does not provide suitable SLA term monitors. In this paper we describe an approach to effectively report and assist service monitoring support groups in managing this provision. The approach described is illustrated with mechanical support in the form of a SMaRT Workbench Eclipse IDE plug-in for reporting on the monitorability of SLAs for service monitoring infrastructures. Â© 2011 ACM.","Monitorability assessment; Monitoring capabilities; Run-time SLA monitoring","ACM SIGSOFT;IEEE CS",,"3rd International Workshop on Principles of Engineering Service-Oriented Systems, PESOS 2011, Co-located with ICSE 2011","23 May 2011 through 24 May 2011","Waikiki, Honolulu, HI",85275,"Conference Paper","Scopus"
"Intelligent software development environments: Integrating natural language processing with the eclipse platform","Witte R., Sateli B., Khamis N., Rilling J.","https://www.scopus.com/inward/record.uri?eid=2-s2.0-79957950356&doi=10.1007%2f978-3-642-21043-3-49&partnerID=40&md5=8e84a1191dbb2881010b16d4e3532669",2011,"Lecture Notes in Computer Science (including subseries Lecture Notes in Artificial Intelligence and Lecture Notes in Bioinformatics)","Software engineers need to be able to create, modify, and analyze knowledge stored in software artifacts. A significant amount of these artifacts contain natural language, like version control commit messages, source code comments, or bug reports. Integrated software development environments (IDEs) are widely used, but they are only concerned with structured software artifacts - they do not offer support for analyzing unstructured natural language and relating this knowledge with the source code. We present an integration of natural language processing capabilities into the Eclipse framework, a widely used software IDE. It allows to execute NLP analysis pipelines through the Semantic Assistants framework, a service-oriented architecture for brokering NLP services based on GATE. We demonstrate a number of semantic analysis services helpful in software engineering tasks, and evaluate one task in detail, the quality analysis of source code comments. Â© 2011 Springer-Verlag.",,"Canadian Artificial Intelligence Association (CAIAC);Memorial University;Compusult;Palomino System Innovations Inc.;University of Regina",,"24th Canadian Conference on Artificial Intelligence, AI 2011, Collocated with the 37th Graphics Interface Conference, GI 2011 and 8th Canadian Conference on Computer and Robot Vision, CRV 2011","25 May 2011 through 27 May 2011","St. John's, NL",85054,"Conference Paper","Scopus"
"Not my bug! and other reasons for software bug report reassignments","Guo P.J., Zimmermann T., Nagappan N., Murphy B.","https://www.scopus.com/inward/record.uri?eid=2-s2.0-79955128266&doi=10.1145%2f1958824.1958887&partnerID=40&md5=e970bfe1e04289c2ed30a4fc9e24faea",2011,"Proceedings of the ACM Conference on Computer Supported Cooperative Work, CSCW","Bug reporting/fixing is an important social part of the software development process. The bug-fixing process inherently has strong inter-personal dynamics at play, especially in how to find the optimal person to handle a bug report. Bug report reassignments, which are a common part of the bug-fixing process, have rarely been studied. In this paper, we present a large-scale quantitative and qualitative analysis of the bug reassignment process in the Microsoft Windows Vista operating system project. We quantify social interactions in terms of both useful and harmful reassignments. For instance, we found that reassignments are useful to determine the best person to fix a bug, contrary to the popular opinion that reassignments are always harmful. We categorized five primary reasons for reassignments: finding the root cause, determining ownership, poor bug report quality, hard to determine proper fix, and workload balancing. We then use these findings to make recommendations for the design of more socially-aware bug tracking systems that can overcome some of the inefficiencies we observed in our study. Copyright 2011 ACM.","Bug reassignment; Bug tracking; Bug triaging","SIGCHI",,"ACM 2011 Conference on Computer Supported Cooperative Work, CSCW 2011","19 March 2011 through 23 March 2011","Hangzhou",84592,"Conference Paper","Scopus"
"AskHERMES: An online question answering system for complex clinical questions","Cao Y., Liu F., Simpson P., Antieau L., Bennett A., Cimino J.J., Ely J., Yu H.","https://www.scopus.com/inward/record.uri?eid=2-s2.0-79952770126&doi=10.1016%2fj.jbi.2011.01.004&partnerID=40&md5=666f1d30c9842fdabb0341dde7c155dc",2011,"Journal of Biomedical Informatics","Objective: Clinical questions are often long and complex and take many forms. We have built a clinical question answering system named AskHERMES to perform robust semantic analysis on complex clinical questions and output question-focused extractive summaries as answers. Design: This paper describes the system architecture and a preliminary evaluation of AskHERMES, which implements innovative approaches in question analysis, summarization, and answer presentation. Five types of resources were indexed in this system: MEDLINE abstracts, PubMed Central full-text articles, eMedicine documents, clinical guidelines and Wikipedia articles. Measurement: We compared the AskHERMES system with Google (Google and Google Scholar) and UpToDate and asked physicians to score the three systems by ease of use, quality of answer, time spent, and overall performance. Results: AskHERMES allows physicians to enter a question in a natural way with minimal query formulation and allows physicians to efficiently navigate among all the answer sentences to quickly meet their information needs. In contrast, physicians need to formulate queries to search for information in Google and UpToDate. The development of the AskHERMES system is still at an early stage, and the knowledge resource is limited compared with Google or UpToDate. Nevertheless, the evaluation results show that AskHERMES' performance is comparable to the other systems. In particular, when answering complex clinical questions, it demonstrates the potential to outperform both Google and UpToDate systems. Conclusions: AskHERMES, available at http://www.AskHERMES.org, has the potential to help physicians practice evidence-based medicine and improve the quality of patient care. Â© 2011 Elsevier Inc.","Answer presentation; Clinical question answering; Passage retrieval; Question analysis; Summarization",,,,,,,"Article","Scopus"
"ISENGARD: An infrastructure for supporting e-Science and grid application development","Kurniawan D., Abramson D.","https://www.scopus.com/inward/record.uri?eid=2-s2.0-79951765106&doi=10.1002%2fcpe.1662&partnerID=40&md5=fcdfc451bfa2540d9c306bb88a6b2535",2011,"Concurrency Computation Practice and Experience","Grid computing facilitates the aggregation and coordination of resources that are distributed across multiple administrative domains for large-scale and complex e-Science experiments. Writing, deploying, and testing grid applications over highly heterogeneous and distributed resources are complex and challenging. The process requires grid-enabled programming tools that can handle the complexity and scale of the infrastructure. However, while a large amount of research has been undertaken into grid middleware, little work has been directed specifically at the area of grid application development tools. This paper presents the design and implementation of ISENGARD, an infrastructure for supporting e-Science and grid application development. ISENGARD provides services, tools, and APIs that simplify grid software development. Â© 2010 John Wiley & Sons, Ltd.","application development; grid computing; IDE",,,,,,,"Article","Scopus"
