"Title","Authors","Link","Year","Source title","Abstract","Author Keywords","Sponsors","Publisher","Conference name","Conference date","Conference location","Conference code","Document Type","Source"
"Reverse engineering reusable software components from object-oriented APIs","Shatnawi A., Seriai A.-D., Sahraoui H., Alshara Z.","https://www.scopus.com/inward/record.uri?eid=2-s2.0-85002957064&doi=10.1016%2fj.jss.2016.06.101&partnerID=40&md5=c1d6513afff820e171aa3013bb284ad6",2017,"Journal of Systems and Software","Object-oriented Application Programing Interfaces (APIs) support software reuse by providing pre-implemented functionalities. Due to the huge number of included classes, reusing and understanding large APIs is a complex task. Otherwise, software components are accepted to be more reusable and understandable entities than object-oriented ones. Thus, in this paper, we propose an approach for reengineering object-oriented APIs into component-based ones. We mine components as a group of classes based on the frequency they are used together and their ability to form a quality-centric component. To validate our approach, we experimented on 100 Java applications that used four APIs. Â© 2016 Elsevier Inc.","API; Frequent usage pattern; Object-oriented; Reverse engineering; Software component; Software reuse",,"Elsevier Inc.",,,,,"Article","Scopus"
"2-step word alignment framework for Thai-English statistical machine translation","Luekhong P., Ruangrajitpakorn T., Sukhahuta R., Supnithi T.","https://www.scopus.com/inward/record.uri?eid=2-s2.0-85040814274&partnerID=40&md5=17eda0f599930602be6fa072ad18fb87",2017,"Information (Japan)","This paper presents a framework of a new word alignment process for SMT and the translation table improvement method with bilingual dictionary that was the lexical probabilistic tuning methodology for translation table in SMT. First, the alignment method was designed to include the quality of using dictionary as prior knowledge and the ability of co-occurrence to fill unknown words. By testing the proposed framework against the renowned GIZA, we applied an alignment model from both systems to Moses for proving its usefulness in a practical hierarchical phrase-based translation usage and exploited a BLEU score as a measurement. The case study in this work focused on Thai to English translation. The testing results showed the proposed method can overrun the result of GIZA IBM model-4 by 2.09 BLEU points. Â© 2017 International Information Institute.","Bilingual dictionary; Hybrid alignment; Machine translation; Thai english hierarchical phrase based translation; Word alignment",,"International Information Institute Ltd.",,,,,"Article","Scopus"
"Smart Base Station-Assisted Partial-Flow Device-to-Device Offloading System for Video Streaming Services","Park G.S., Kim W., Jeong S.H., Song H.","https://www.scopus.com/inward/record.uri?eid=2-s2.0-85029364279&doi=10.1109%2fTMC.2016.2626434&partnerID=40&md5=0836bcaedc84507c6c2a09064a15e5e7",2017,"IEEE Transactions on Mobile Computing","This paper presents a smart base station-assisted partial-flow device-to-device offloading system that provides seamless video streaming services to clients by effectively offloading parts of the video traffic to D2D networks in order to alleviate the cellular network traffic load. In the proposed system, the main functionalities of the content centric networking (CCN) technology are deployed for efficient and fast cached content management at the base stations and in the devices. First, a logical overlay Chord-like network is constructed among the smart base stations for effectively handling significant numbers of the distributed contents. Then, content management protocols over the Chord-like network are implemented for rapidly finding the D2D server that contains the cached content requested by the D2D client. A two-stage PID-based LTE traffic controller is proposed to determine the amount of traffic to be offloaded to the D2D network among the cellular operator, the D2D servers, and the D2D clients. The proposed system is fully implemented using a CCNx open source and C/C++. Experimental results are provided to demonstrate the performance improvement of the proposed system. Â© 2017 IEEE.","chord-like network; Content centric networking; partial-flow device-to-device offloading; two-stage PID-based LTE traffic controller",,"Institute of Electrical and Electronics Engineers Inc.",,,,,"Article","Scopus"
"Is Tom Cruise threatened? An empirical study of the impact of product variety on demand concentration","Tan T.F., Netessine S., Hitt L.","https://www.scopus.com/inward/record.uri?eid=2-s2.0-85031681246&doi=10.1287%2fisre.2017.0712&partnerID=40&md5=810c248d5e5a176a73ef319049af3a3f",2017,"Information Systems Research","We empirically examine the impact of expanded product variety on demand concentration using large data sets from the movie rental industry as our test bed.We find that product variety is likely to increase demand concentration, which goes against the ""long tail effect"" theory predicting that demand will become less concentrated on ""hit"" products because of expanded product variety. We further provide evidence that this finding is not due to introducing many low-selling niche products, as the intuition might suggest. Instead, we discover that increasing product variety diversifies the demand away from each movie title, but less significantly for hits than for niche products. In particular, we find that increasing product variety by 1,000 titles may increase the Gini coefficient of DVD rentals by 0.0029, which translates to increasing the market share of the top 1% of DVDs by 1.96% and the market share of the top 10% of DVDs by 0.58%. At the same time, the market share of the bottom 1% of DVDs is reduced by 21.29%, while the market share of the bottom 10% ofDVDs is reduced by 5.28%.We rule out alternative explanations using a variety of long tail metrics, capturing movie format/distribution channel interaction and customer heterogeneity, while making use of instrumental variables. Â© 2017 INFORMS.","Demand concentration; Movie rental; Product rating; Product variety; The long tail effect",,"INFORMS Inst.for Operations Res.and the Management Sciences",,,,,"Article","Scopus"
"Logistic informatics modelling using concept of stratification (CST)","Asadabadi M.R., Saberi M., Chang E.","https://www.scopus.com/inward/record.uri?eid=2-s2.0-85030157702&doi=10.1109%2fFUZZ-IEEE.2017.8015510&partnerID=40&md5=11bc3ad4ccf1e3dc8537f1150d305527",2017,"IEEE International Conference on Fuzzy Systems","The concept of stratification (CST) is a reform in problem solving approaches in computer science introduced and developed by Lotfi Zadeh [1]. In this approach, the target set is a set of the initial states. The environment around the target is then systematically identified and strata around the target are gradually built using the concept of 'incremental target enlargement'. We advocate that this approach is useful in different areas; however, it is essential to highlight the potential applicability of the approach by presenting different examples. In this paper illustrative examples in Information Dominance (ID) and in requirement elicitation in contracting, are structured using CST. These examples show the application of the concept in the contexts of logistic informatics and contracting and assists the modelling process. Of particular relevance are Example 4 and 5. Example 4 exposes situations that are not dealt with in the current form of CST. The study, therefore, extends CST by considering the possibility of occasional state repetition while using the same input. Further, a 3D version of CST is structured and examined through example 5. This proposed version of the concept illustrates how the Fuzzy Inference System (FIS) benefits the user when applying CST. Â© 2017 IEEE.","3D CST; Concept of Stratification (CST); CST extensions; Fuzzy CST",,"Institute of Electrical and Electronics Engineers Inc.","2017 IEEE International Conference on Fuzzy Systems, FUZZ 2017","9 July 2017 through 12 July 2017",,130106,"Conference Paper","Scopus"
"How do developers toggle breakpoints? observational studies","Petrillo F., Mandian H., Yamashita A., Khomh F., Gueheneuc Y.-G.","https://www.scopus.com/inward/record.uri?eid=2-s2.0-85029415238&doi=10.1109%2fQRS.2017.39&partnerID=40&md5=b7a93540e5d3b1522bd04c53ba73fa2a",2017,"Proceedings - 2017 IEEE International Conference on Software Quality, Reliability and Security, QRS 2017","One of the most important tasks in software maintenance is debugging. Developers perform debugging to fix faults and implement new features. Usually they use interactive development environments to perform their debugging sessions. To start an interactive debugging session, developers must set breakpoints. Choosing where to set breakpoints is a non-trivial task, yet few studies have investigated how developers set breakpoints during interactive debugging sessions. To understand how developers set breakpoints, we analysed more than 10 hours of 45 video-recorded debugging sessions, where a total of 307 breakpoints were set. We used the videos from two independent studies involving three software systems. We could observe that: (1) considerable time is spent by developers until they are able to set the first breakpoint; (2) when developers toggle breakpoints carefully, they complete tasks faster than developers who set (potential useless) breakpoints quickly; and (3) different developers set breakpoints in similar locations while working (independently) on the same tasks or different tasks. We discuss some implications of our observations for debugging activities. Â© 2017 IEEE.","Breakpoints; Debugging; Empirical software engineering; Interactive debugging",,"Institute of Electrical and Electronics Engineers Inc.","17th IEEE International Conference on Software Quality, Reliability and Security, QRS 2017","25 July 2017 through 29 July 2017",,129990,"Conference Paper","Scopus"
"IDE-based learning analytics for computing education: A process model, critical review, and research agenda","Hundhausen C.D., Olivares D.M., Carter A.S.","https://www.scopus.com/inward/record.uri?eid=2-s2.0-85028590656&doi=10.1145%2f3105759&partnerID=40&md5=9a6b0f49ff8b451657f88e6480c95229",2017,"ACM Transactions on Computing Education","In recent years, learning process data have become increasingly easy to collect through computer-based learning environments. This has led to increased interest in the field of learning analytics, which is concerned with leveraging learning process data in order to better understand, and ultimately to improve, teaching and learning. In computing education, the logical place to collect learning process data is through integrated development environments (IDEs), where computing students typically spend large amounts of time working on programming assignments. While the primary purpose of IDEs is to support computer programming, they might also be used as a mechanism for delivering learning interventions designed to enhance student learning. The possibility of using IDEs both to collect learning process data, and to strategically intervene in the learning process, suggests an exciting design space for computing education research: that of IDE-based learning analytics. In order to facilitate the systematic exploration of this design space, we present an IDE-based data analytics process model with four primary activities: (1) Collect data, (2) Analyze data, (3) Design intervention, and (4) Deliver intervention. For each activity, we identify key design dimensions and review relevant computing education literature. To provide guidance on designing effective interventions, we describe four relevant learning theories, and consider their implications for design. Based on our review, we present a call-to-action for future research into IDE-based learning analytics. Â© 2017 ACM.","Learning analytics; Learning interventions; Learning process data",,"Association for Computing Machinery",,,,,"Article","Scopus"
"Software integration in global software development: Challenges for GSD vendors","Ilyas M., Khan S.U.","https://www.scopus.com/inward/record.uri?eid=2-s2.0-85018645451&doi=10.1002%2fsmr.1875&partnerID=40&md5=a93df461a87aa7b68020f60c06cfaa0d",2017,"Journal of Software: Evolution and Process","Context: The advances in information and communication technologies have revolutionized the software development environment from local to global software development (GSD). This revolution also created challenges for vendor organizations. Vendors face challenges in integrating the components developed independently by GSD teams into a final working product. Objective: The objectives of the current study is to find out those critical barriers/challenges that hinder the integration process at any stage in the GSD environment for different types and size of projects. Methodology: For achieving the objectives we initially conducted a comprehensive systematic literature review (SLR). We searched 6 digital libraries and also followed the snowballing technique. The data was extracted from a total of 88 finally selected papers. Findings of the SLR study were then empirically validated through a questionnaire survey in GSD industry. A total of 96 experts from 22 different countries participated in the survey. Results: We have found a total of 16 barriers/challenges among which ten barriers are ranked as critical barriers/challenges. Some of the top ranked barriers are â€œlack of communication,â€ â€œlack of proper documentation,â€ â€œlack of compatibility,â€ and â€œarchitecture mismatch.â€ The findings of our industrial survey are mostly coherent with the SLR findings. However, there is a difference in ranks of the various barriers/challenges across the 2 data sets (SLR and industrial survey). The identified challenges need to be properly addressed by software vendors to reduce the complexity of the integration process in GSD projects. Conclusion: We found that the severity of these barriers increases in large size projects. On the other hand, bespoke products are more affected by â€œlack of communication,â€ while off-the-shelfâ€“based projects face integration problems due to â€œlack of compatibility,â€ â€œarchitecture mismatch,â€ and â€œwrong off the shelf product selection and customizationâ€. Copyright Â© 2017 John Wiley & Sons, Ltd.","barriers/challenges; empirical study; global software development; software integration; systematic literature review",,"John Wiley and Sons Ltd",,,,,"Article","Scopus"
"On code reuse from StackOverflow: An exploratory study on Android apps","Abdalkareem R., Shihab E., Rilling J.","https://www.scopus.com/inward/record.uri?eid=2-s2.0-85018752207&doi=10.1016%2fj.infsof.2017.04.005&partnerID=40&md5=8d8c2e6e0a5eaa518a14977f300ecd8f",2017,"Information and Software Technology","Context: Source code reuse has been widely accepted as a fundamental activity in software development. Recent studies showed that StackOverflow has emerged as one of the most popular resources for code reuse. Therefore, a plethora of work proposed ways to optimally ask questions, search for answers and find relevant code on StackOverflow. However, little work studies the impact of code reuse from StackOverflow. Objective: To better understand the impact of code reuse from StackOverflow, we perform an exploratory study focusing on code reuse from StackOverflow in the context of mobile apps. Specifically, we investigate how much, why, when, and who reuses code. Moreover, to understand the potential implications of code reuse, we examine the percentage of bugs in files that reuse StackOverflow code. Method: We perform our study on 22 open source Android apps. For each project, we mine their source code and use clone detection techniques to identify code that is reused from StackOverflow. We then apply different quantitative and qualitative methods to answer our research questions. Results: Our findings indicate that 1) the amount of reused StackOverflow code varies for different mobile apps, 2) feature additions and enhancements in apps are the main reasons for code reuse from StackOverflow, 3) mid-age and older apps reuse StackOverflow code mostly later on in their project lifetime and 4) that in smaller teams/apps, more experienced developers reuse code, whereas in larger teams/apps, the less experienced developers reuse code the most. Additionally, we found that the percentage of bugs is higher in files after reusing code from StackOverflow. Conclusion: Our results provide insights on the potential impact of code reuse from StackOverflow on mobile apps. Furthermore, these results can benefit the research community in developing new techniques and tools to facilitate and improve code reuse from StackOverflow. Â© 2017","Code reuse; Mobile app; StackOverflow",,"Elsevier B.V.",,,,,"Article","Scopus"
"Single Image Rain Streak Decomposition Using Layer Priors","Li Y., Tan R.T., Guo X., Lu J., Brown M.S.","https://www.scopus.com/inward/record.uri?eid=2-s2.0-85028405092&doi=10.1109%2fTIP.2017.2708841&partnerID=40&md5=8e6162e86a0849197c091afa7d48c748",2017,"IEEE Transactions on Image Processing","Rain streaks impair visibility of an image and introduce undesirable interference that can severely affect the performance of computer vision and image analysis systems. Rain streak removal algorithms try to recover a rain streak free background scene. In this paper, we address the problem of rain streak removal from a single image by formulating it as a layer decomposition problem, with a rain streak layer superimposed on a background layer containing the true scene content. Existing decomposition methods that address this problem employ either sparse dictionary learning methods or impose a low rank structure on the appearance of the rain streaks. While these methods can improve the overall visibility, their performance can often be unsatisfactory, for they tend to either over-smooth the background images or generate-images that still contain noticeable rain streaks. To address the problems, we propose a method that imposes priors for both the background and rain streak layers. These priors are based on Gaussian mixture models learned on small patches that can accommodate a variety of background appearances as well as the appearance of the rain streaks. Moreover, we introduce a structure residue recovery step to further separate the background residues and improve the decomposition quality. Quantitative evaluation shows our method outperforms existing methods by a large margin. We overview our method and demonstrate its effectiveness over prior work on a number of examples. Â© 2017 IEEE.","Gaussian mixture models; image decomposition; image prior; Rain removal; visibility recovery",,"Institute of Electrical and Electronics Engineers Inc.",,,,,"Article","Scopus"
"Learning syntactic program transformations from examples","Rolim R., Soares G., D'Antoni L., Polozov O., Gulwani S., Gheyi R., Suzuki R., Hartmann B.","https://www.scopus.com/inward/record.uri?eid=2-s2.0-85019549570&doi=10.1109%2fICSE.2017.44&partnerID=40&md5=b3a45063807a0c115be86bd635b81949",2017,"Proceedings - 2017 IEEE/ACM 39th International Conference on Software Engineering, ICSE 2017","Automatic program transformation tools can be valuable for programmers to help them with refactoring tasks, and for Computer Science students in the form of tutoring systems that suggest repairs to programming assignments. However, manually creating catalogs of transformations is complex and time-consuming. In this paper, we present REFAZER, a technique for automatically learning program transformations. REFAZER builds on the observation that code edits performed by developers can be used as input-output examples for learning program transformations. Example edits may share the same structure but involve different variables and subexpressions, which must be generalized in a transformation at the right level of abstraction. To learn transformations, REFAZER leverages state-of-The-Art programming-by-example methodology using the following key components: (a) a novel domain-specific language (DSL) for describing program transformations, (b) domain-specific deductive algorithms for efficiently synthesizing transformations in the DSL, and (c) functions for ranking the synthesized transformations. We instantiate and evaluate REFAZER in two domains. First, given examples of code edits used by students to fix incorrect programming assignment submissions, we learn program transformations that can fix other students' submissions with similar faults. In our evaluation conducted on 4 programming tasks performed by 720 students, our technique helped to fix incorrect submissions for 87% of the students. In the second domain, we use repetitive code edits applied by developers to the same project to synthesize a program transformation that applies these edits to other locations in the code. In our evaluation conducted on 56 scenarios of repetitive edits taken from three large C# open-source projects, REFAZER learns the intended program transformation in 84% of the cases using only 2.9 examples on average. Â© 2017 IEEE.","Program Synthesis; Program transformation; Refactoring; Tutoring Systems","Association for Computing Machinery;et al.;Exactas UBA 150;IEEE Computer Society;IEEE Technical Council on Software Engineering (TCSE);Special Interest Group on Software Engineering (SIGSOFT)","Institute of Electrical and Electronics Engineers Inc.","39th IEEE/ACM International Conference on Software Engineering, ICSE 2017","20 May 2017 through 28 May 2017",,129335,"Conference Paper","Scopus"
"Code smells detection 2.0: Crowdsmelling and visualization","Dos Reis J.P., Abreu E.F.B., Carneiro D.F.G.","https://www.scopus.com/inward/record.uri?eid=2-s2.0-85027080493&doi=10.23919%2fCISTI.2017.7975961&partnerID=40&md5=4d0c3caed7d7321b13b92450c9c4d3b2",2017,"Iberian Conference on Information Systems and Technologies, CISTI","Background: Code smells have long been catalogued with corresponding mitigating solutions called refactoring operations. However, while the latter are supported in several IDEs, code smells detection scaffolding still has many limitations. Another aspect deserving attention is code smells visualization, to increase software quality awareness, namely in large projects, where maintainability is often the dominating issue. Research problems: Researchers have pointed out that code smells detection is inherently a subjective process and that is probably the main hindrance on providing automatic support. Regarding visualization, customized views are required, because each code smell type may have a different scope. Choosing the right visualization for each code smell type is an open research topic. Expected contributions: This research work focuses on the code smells detection and awareness process, by proposing two symbiotic contributions: crowdsmelling and smelly maps. We envisage that such features will be available in a future generation of interactive development environments (aka IDE 2.0). Crowdsmelling uses the concept of collective intelligence through which programmers around the world will collaboratively contribute to the calibration of code smells detection algorithms (one per each code smell), hopefully improving the detection accuracy and mitigating the subjectivity problem. Smelly maps build upon the aforementioned code smells detection capability and on the previous experience at UNIFACS of setting up a software visualization infrastructure. We expect to represent detected code smells at different abstraction levels with the goal of increasing software quality awareness and facilitating refactoring decisions upon large software systems. Â© 2017 AISTI.","Code Smell; Code Smells Detection; Crowdsmelling; Crowdsourcing; IDE 2.0; Refactoring; Smelly Maps; Software Construction; Software Maintenance; Software Quality","Asociacion de Tecnicos de Informatica (ATI);Empreend - Associacao Portuguesa para o Empreendedorismo;et al.;FCA;IEEE Portugal Section;IEEE SMC","IEEE Computer Society","12th Iberian Conference on Information Systems and Technologies, CISTI 2017","21 June 2017 through 24 June 2017",,129105,"Conference Paper","Scopus"
