"Title","Authors","Link","Year","Source title","Abstract","Author Keywords","Sponsors","Publisher","Conference name","Conference date","Conference location","Conference code","Document Type","Source"
"Design Guidelines for Business Intelligence Tools for Novice Users","Smuts M., Scholtz B., Calitz A.","https://www.scopus.com/inward/record.uri?eid=2-s2.0-84959431827&doi=10.1145%2f2815782.2815788&partnerID=40&md5=f2fc28815d0aff703770f63999be4d67",2015,"ACM International Conference Proceeding Series","The use of interactive dashboards has become a popular technique to aid users in Business Intelligence (BI) analysis and data discovery. The increase in the number of BI platforms on the market is driven by the expanding end-user population. A wider range of novice users, such as business users with minimal Information Technology (IT) or data science skills, are demanding BI tools that support rapid and easy dashboard development. Dashboard development is often a tedious process, involving a number of developers and software tools. Self-service BI tools are becoming prominent environments in which novice users can fulfil their BI requirements without the intervention of IT experts. However, the usability of BI tools has not fully matured to a level where novice users can utilise its features efficiently and effectively without the assistance from IT experts. Limited research has been conducted regarding usability criteria specific to BI tools that support novice users. The purpose of this paper is to expand on existing BI usability criteria for supporting novice users with their data analysis activities. Furthermore, the study proposes a set of design guidelines that can be used as a reference for designing, evaluating and selecting BI tools that aid novice users. Evaluations were carried out on current BI tools to investigate its usability and the extent to which these tools follow the proposed guidelines. Additionally, a field study was conducted with novice users to evaluate the difficulties of current BI tools. This study is concerned with the design of front-end features and usability of BI tools and not on the design of dashboards itself. The results indicated that the proposed design guidelines can be effectively used to select a BI tool for novices. Â© 2015 ACM.","Business intelligence; Dashboards; Design guidelines; Information Visualisation; Novice users","Amazon Development Centre Cape Town;IBM South Africa;Information Science Department and the Centre for AI Research at Stellenbosch University;Meraka Institute of the Council for Scientific and Industrial Research (CSIR);Microsoft South Africa;OutSystems South Africa","Association for Computing Machinery","2015 Annual Research Conference of the South African Institute of Computer Scientists and Information Technologists, SAICSIT 2015","28 September 2015 through 30 September 2015",,118802,"Conference Paper","Scopus"
"Identifying Renaming Opportunities by Expanding Conducted Rename Refactorings","Liu H., Liu Q., Liu Y., Wang Z.","https://www.scopus.com/inward/record.uri?eid=2-s2.0-84942323643&doi=10.1109%2fTSE.2015.2427831&partnerID=40&md5=0f60862fcefb27520a2ca7a172b93895",2015,"IEEE Transactions on Software Engineering","To facilitate software refactoring, a number of approaches and tools have been proposed to suggest where refactorings should be conducted. However, identification of such refactoring opportunities is usually difficult because it often involves difficult semantic analysis and it is often influenced by many factors besides source code. For example, whether a software entity should be renamed depends on the meaning of its original name (natural language understanding), the semantics of the entity (source code semantics), experience and preference of developers, and culture of companies. As a result, it is difficult to identify renaming opportunities. To this end, in this paper we propose an approach to identify renaming opportunities by expanding conducted renamings. Once a rename refactoring is conducted manually or with tool support, the proposed approach recommends to rename closely related software entities whose names are similar to that of the renamed entity. The rationale is that if an engineer makes a mistake in naming a software entity it is likely for her to make the same mistake in naming similar and closely related software entities. The main advantage of the proposed approach is that it does not involve difficult semantic analysis of source code or complex natural language understanding. Another advantage of this approach is that it is less influenced by subjective factors, e.g., experience and preference of software engineers. The proposed approach has been evaluated on four open-source applications. Our evaluation results show that the proposed approach is accurate in recommending entities to be renamed (average precision 82 percent) and in recommending new names for such entities (average precision 93 percent). Evaluation results also suggest that a substantial percentage (varying from 20 to 23 percent) of rename refactorings are expansible. Â© 2015 IEEE.","Code Smells; Identification; Refactoring Opportunity; Rename; Software Refactoring",,"Institute of Electrical and Electronics Engineers Inc.",,,,,"Article","Scopus"
"Implementation of Multimodal Interactive Continuous Scoring for 3D Quality of Experience","Kang J., Kim T., Lee S.","https://www.scopus.com/inward/record.uri?eid=2-s2.0-84957428200&doi=10.1007%2fs11277-015-2680-z&partnerID=40&md5=762ca32c86c39ad5818a5fc2a46d3618",2015,"Wireless Personal Communications","When watching videos in 3D space, viewers perceive dynamic levels of quality of experience accompanied by visual immersion. To measure these dynamics, a reliable methodology is needed to gauge subjective viewer experience. This paper proposes a new methodology called multimodal interactive continuous scoring of quality (MICSQ). MICSQ is comprised of device interaction processes between the 3D display and tablet assessment tool and human interaction processes between the subject and tablet. When MICSQ device interaction takes place over wireless network protocols, such as TCP/IP or Bluetooth, it efficiently handles the diverse viewing environment. Therefore, there is a high degree of freedom to perform subjective assessment in certain viewing environments in terms of multimodal cues (aural and tactile senses), diverse illumination conditions including darkness, handheld portability over wireless networks, and real-time recording. Moreover, it is also possible for multiple subjects to simultaneously perform assessments in a large space, such as a movie theater. For the simulations, the server application in the 3D display was developed in Java, and the tablet device client application was developed with a mobile software development kit and functions optimally in commercial tablets. The experimental results demonstrate that MICSQ shows a higher reliability than the conventional single stimulus continuous quality evaluation method through the proposed implementation on a commercial tablet PC. Â© 2015, Springer Science+Business Media New York.","3D QoE; Interactive continuous quality evaluation; Mobile assessment device; Visual discomfort; Wireless quality assessment",,"Springer New York LLC",,,,,"Article","Scopus"
"Crowd debugging","Chen F., Kim S.","https://www.scopus.com/inward/record.uri?eid=2-s2.0-84960393115&doi=10.1145%2f2786805.2786819&partnerID=40&md5=b989d9a2a1cb36798ea196dae432e413",2015,"2015 10th Joint Meeting of the European Software Engineering Conference and the ACM SIGSOFT Symposium on the Foundations of Software Engineering, ESEC/FSE 2015 - Proceedings","Research shows that, in general, many people turn to QA sites to solicit answers to their problems. We observe in Stack Overflow a huge number of recurring questions, 1,632,590, despite mechanisms having been put into place to prevent these recurring questions. Recurring questions imply developers are facing similar issues in their source code. However, limitations exist in the QA sites. Developers need to visit them frequently and/or should be familiar with all the content to take advantage of the crowd's knowledge. Due to the large and rapid growth of QA data, it is difficult, if not impossible for developers to catch up. To address these limitations, we propose mining the QA site, Stack Overflow, to leverage the huge mass of crowd knowledge to help developers debug their code. Our approach reveals 189 warnings and 171 (90.5%) of them are confirmed by developers from eight high-quality and well-maintained projects. Developers appreciate these findings because the crowd provides solutions and comprehensive explanations to the issues. We compared the confirmed bugs with three popular static analysis tools (FindBugs, JLint and PMD). Of the 171 bugs identified by our approach, only FindBugs detected six of them whereas JLint and PMD detected none. Â© 2015 ACM.","Crowd debugging; Crowd sourcing; Debugging","Association for Computing Machinery Special Interest Group on Software Engineering (ACM SIGSOFT)","Association for Computing Machinery, Inc","10th Joint Meeting of the European Software Engineering Conference and the ACM SIGSOFT Symposium on the Foundations of Software Engineering, ESEC/FSE 2015","30 August 2015 through 4 September 2015",,118131,"Conference Paper","Scopus"
"Everything as a Service (XaaS) on the Cloud: Origins, Current and Future Trends","Duan Y., Fu G., Zhou N., Sun X., Narendra N.C., Hu B.","https://www.scopus.com/inward/record.uri?eid=2-s2.0-84960153644&doi=10.1109%2fCLOUD.2015.88&partnerID=40&md5=b38f81c01ad5c94f48abdd3ab67fb335",2015,"Proceedings - 2015 IEEE 8th International Conference on Cloud Computing, CLOUD 2015","For several years now, scientists have been proposing numerous models for defining anything 'as a service (aaS)', including discussions of products, processes, data &amp; information management, and security as a service. In this paper, based on a thorough literature survey, we investigate the vast stream of the state of the art in Everything as a Service (XaaS). We then use this investigation to explore an integrated view of XaaS that will help propose approaches for migrating applications to the cloud and exposing them as services. Â© 2015 IEEE.","Anything as a Service; Cloud computing; Everything as a Service; SOA","IEEE Computer Society Technical Committee on Services Computing (TC-SVC);Services Society (SS)","Institute of Electrical and Electronics Engineers Inc.","8th IEEE International Conference on Cloud Computing, CLOUD 2015","27 June 2015 through 2 July 2015",,116940,"Conference Paper","Scopus"
"CodeAware: Sensor-Based Fine-Grained Monitoring and Management of Software Artifacts","Abreu R., Erdogmus H., Perez A.","https://www.scopus.com/inward/record.uri?eid=2-s2.0-84951805742&doi=10.1109%2fICSE.2015.192&partnerID=40&md5=7d9cf8c0544935b910f13d38347530e5",2015,"Proceedings - International Conference on Software Engineering","Current continuous integration (CI) tools, although extensible, can be limiting in terms of flexibility. In particular, artifact analysis capabilities available through plug in mechanisms are both coarse-grained and centralized. To address this limitation, this paper introduces a new paradigm, Code Aware, for distributed and fine-grained artifact analysis. Code Aware is an ecosystem inspired by sensor networks, consisting of monitors and actuators, aimed at improving code quality and team productivity. Code ware's vision entails (a) the ability to probe software artifacts of any granularity and localization, from variables to classes or files to entire systems, (b) the ability to perform both static and dynamic analyses on these artifacts, and (c) the ability to describe targeted remediation actions, for example to notify interested developers, through automated actuators. We provide motivational examples for the use of Code Aware that leverage current CI solutions, sketch the architecture of its underlying ecosystem, and outline research challenges. Â© 2015 IEEE.",,"Association for Computing Machinery Special Interest Group on Software Engineering (ACM SIGSOFT);IEEE Computer Society Technical Council on Software Engineering (TCSE)","IEEE Computer Society","37th IEEE/ACM International Conference on Software Engineering, ICSE 2015","16 May 2015 through 24 May 2015",,116104,"Conference Paper","Scopus"
"DIETs: Recommender Systems for Mobile API Developers","Beyer S.","https://www.scopus.com/inward/record.uri?eid=2-s2.0-84951770011&doi=10.1109%2fICSE.2015.278&partnerID=40&md5=6bfd3771d3ef5aaf08adda263ceb955a",2015,"Proceedings - International Conference on Software Engineering","The increasing number of posts related to mobile app development indicates unaddressed problems in the usage of mobile APIs. Arguing that these problems result from in- adequate documentation and shortcomings in the design and implementation of the APIs, the goal of this research is to develop and evaluate two developers' issues elimination tools (DIETs) for mobile API developers to diminish the problems of mobile applications (apps) development.After categorizing the problems, we investigate their causes, by exploring the relationships between the topics and trends of posts on Stack Overflow, the app developers' experience, the API and test code, and its changes. The results of these studies will be used to develop two DIETs that support API developers to improve the documentation, design, and implementation of their APIs. Â© 2015 IEEE.","Api; Mobile api developers; Recommender systems","Association for Computing Machinery Special Interest Group on Software Engineering (ACM SIGSOFT);IEEE Computer Society Technical Council on Software Engineering (TCSE)","IEEE Computer Society","37th IEEE/ACM International Conference on Software Engineering, ICSE 2015","16 May 2015 through 24 May 2015",,116104,"Conference Paper","Scopus"
"Borrowing from the crowd: A study of recombination in software design competitions","La Toza T.D., Chen M., Jiang L., Zhao M., Van Der Hoek A.","https://www.scopus.com/inward/record.uri?eid=2-s2.0-84951850707&doi=10.1109%2fICSE.2015.72&partnerID=40&md5=97a08a2de3da5d5d9c06e029dad0eabb",2015,"Proceedings - International Conference on Software Engineering","One form of crowdsourcing is the competition, which poses an open call for competing solutions. Commercial systems such as TopCoder have begun to explore the application of competitions to software development, but have important limitations diminishing the potential benefits drawn from the crowd. In particular, they employ a model of independent work that ignores the opportunity for designs to arise from the ideas of multiple designers. In this paper, we examine the potential for software design competitions to incorporate recombination, in which competing designers are given the designs of others and encouraged to use them to revise their own designs. To explore this, we conducted two software design competitions in which participants were asked to produce both an initial and a revised design, drawing on lessons learned from the crowd. We found that, in both competitions, all participants borrowed ideas and most improved the quality of their designs. Our findings demonstrate the potential benefits of recombination in software design and suggest several ways in which software design competitions can be improved. Â© 2015 IEEE.","Collaborative design; Collective intelligence; Crowdsourcing; Software design","Association for Computing Machinery Special Interest Group on Software Engineering (ACM SIGSOFT);IEEE Computer Society Technical Council on Software Engineering (TCSE)","IEEE Computer Society","37th IEEE/ACM International Conference on Software Engineering, ICSE 2015","16 May 2015 through 24 May 2015",,116104,"Conference Paper","Scopus"
"StORMeD: Stack overflow ready made data","Ponzanelli L., Mocci A., Lanza M.","https://www.scopus.com/inward/record.uri?eid=2-s2.0-84957065977&doi=10.1109%2fMSR.2015.67&partnerID=40&md5=b6f301ff96052026e10aa21e6e4a8316",2015,"IEEE International Working Conference on Mining Software Repositories","Stack Overflow is the de facto Question and Answer (Q&A) website for developers, and it has been used in many approaches by software engineering researchers to mine useful data. However, the contents of a Stack Overflow discussion are inherently heterogeneous, mixing natural language, source code, stack traces and configuration files in XML or JSON format. We constructed a full island grammar capable of modeling the set of 700,000 Stack Overflow discussions talking about Java, building a heterogeneous abstract syntax tree (H-AST) of each post (question, answer or comment) in a discussion. The resulting dataset models every Stack Overflow discussion, providing a full H-AST for each type of structured fragment (i.e., JSON, XML, Java, Stack traces), and complementing this information with a set of basic meta-information like term frequency to enable natural language analyses. Our dataset allows the end-user to perform combined analyses of the Stack Overflow by visiting the H-AST of a discussion. Â© 2015 IEEE.","H-ast; Island parsing; Unstructured data","Association for Computing Machinery Special Interest Group on Software Engineering (ACM SIGSOFT);IEEE Computer Society Technical Council on Software Engineering (TCSE)","IEEE Computer Society","12th Working Conference on Mining Software Repositories, MSR 2015","16 May 2015 through 17 May 2015",,117060,"Conference Paper","Scopus"
"Using developer-interaction trails to triage change requests","Zanjani M.B., Kagdi H., Bird C.","https://www.scopus.com/inward/record.uri?eid=2-s2.0-84957103031&doi=10.1109%2fMSR.2015.16&partnerID=40&md5=faccde453e431e69aecab560dd970917",2015,"IEEE International Working Conference on Mining Software Repositories","The paper presents an approach, namely iHDev, to recommend developers who are most likely to implement incoming change requests. The basic premise of iHDev is that the developers who interacted with the source code relevant to a given change request are most likely to best assist with its resolution. A machine-learning technique is first used to locate source code entities relevant to the textual description of a given change request. Ihdev then mines interaction trails (i.e., Mylyn sessions) associated with these source code entities to recommend a ranked list of developers. Ihdev integrates the interaction trails in a unique way to perform its task, which was not investigated previously. An empirical study on open source systems Mylyn and Eclipse Project was conducted to assess the effectiveness of iHDev. A number of change requests were used in the evaluated bench-mark. Recall for top one to five recommended developers and Mean Reciprocal Rank (MRR) values are reported. Furthermore, a comparative study with two previous approaches that use commit histories and/or the source code authorship information for developer recommendation was performed. Results show that iHDev could provide a recall gain of up to 127.27% with equivalent or improved MRR values by up to 112.5%. Â© 2015 IEEE.","Computer bugs; Context; Data mining; History; Mathematical model; Software; XML","Association for Computing Machinery Special Interest Group on Software Engineering (ACM SIGSOFT);IEEE Computer Society Technical Council on Software Engineering (TCSE)","IEEE Computer Society","12th Working Conference on Mining Software Repositories, MSR 2015","16 May 2015 through 17 May 2015",,117060,"Conference Paper","Scopus"
"A cooking-step scheduling algorithm with guidance system for homemade cooking","Matsushima Y., Funabiki N.","https://www.scopus.com/inward/record.uri?eid=2-s2.0-84938909620&doi=10.1587%2ftransinf.2015EDP7048&partnerID=40&md5=fa9e63084ebb2bf65d803f28996ef586",2015,"IEICE Transactions on Information and Systems","Homemade cooking plays a key role for a healthy and cost-efficient life. Unfortunately, preparing multiple dishes is generally time-consuming. In this paper, an algorithm is proposed to minimize the cooking time by scheduling the cooking-step of multiple dishes. The cooking procedure of a dish is divided into a sequence of six types of cooking-steps to consider the constraints in cooks and cooking utensils in a kitchen. A cooking model is presented to optimize the cooking-step schedule and estimate the cooking time for a given starting order of dishes under various constraints of cooks and utensils. Then, a high-quality schedule is sought by repeating the generation of a new order and the model application based on exhaustive search and simulated annealing. Our simulation results and cooking experiments confirm the effectiveness of our proposal. Copyright Â© 2015 The Institute of Electronics, Information and Communication Engineers.","Algorithm; Cooking model; Cooking-step scheduling; Exhaustive search; Homemade cooking; Simulated annealing",,"Maruzen Co., Ltd.",,,,,"Article","Scopus"
"Learning outcome achievement in non-traditional (virtual and remote) versus traditional (hands-on) laboratories: A review of the empirical research","Brinson J.R.","https://www.scopus.com/inward/record.uri?eid=2-s2.0-84937113661&doi=10.1016%2fj.compedu.2015.07.003&partnerID=40&md5=c1c49acc78528c45abd2e8878c767675",2015,"Computers and Education","Abstract This review presents the first attempt to synthesize recent (post-2005) empirical studies that focus on directly comparing learning outcome achievement using traditional lab (TL; hands-on) and non-traditional lab (NTL; virtual and remote) participants as experimental groups. Findings suggest that most studies reviewed (n = 50, 89%) demonstrate student learning outcome achievement is equal or higher in NTL versus TL across all learning outcome categories (knowledge and understanding, inquiry skills, practical skills, perception, analytical skills, and social and scientific communication), though the majority of studies (n = 53, 95%) focused on outcomes related to content knowledge, with most studies (n = 40, 71%) employing quizzes and tests as the assessment instrument. Scientific inquiry skills was the least assessed learning objective (n = 4, 7%), and lab reports/written assignments (n = 5, 9%) and practical exams (n = 5, 9%) were the least common assessment instrument. The results of this review raise several important concerns and questions to be addressed by future research. Â© 2015 Elsevier Ltd.","Distance education and telelearning; Distributed learning environments; Evaluation of CAL systems; Simulations; Teaching/learning strategies",,"Elsevier Ltd",,,,,"Article","Scopus"
"Preventing data errors with continuous testing","MuÅŸlu K., Brun Y., Meliou A.","https://www.scopus.com/inward/record.uri?eid=2-s2.0-84975704360&doi=10.1145%2f2771783.2771792&partnerID=40&md5=1263d390cbde21ddf60fc4628abd06e7",2015,"2015 International Symposium on Software Testing and Analysis, ISSTA 2015 - Proceedings","Today, software systems that rely on data are ubiquitous, and ensuring the data's quality is an increasingly important challenge as data errors result in annual multi-billion dollar losses. While software debugging and testing have received heavy research attention, less effort has been devoted to data debugging: identifying system errors caused by well-formed but incorrect data. We present continuous data testing (CDT), a low-overhead, delay-free technique that quickly identifies likely data errors. CDT continuously executes domain-specific test queries; when a test fails, CDT unobtrusively warns the user or administrator. We implement CDT in the CONTEST prototype for the PostgreSQL database management system. A feasibility user study with 96 humans shows that CONTEST was extremely effective in a setting with a data entry application at guarding against data errors: With CONTEST, users corrected 98.4% of their errors, as opposed to 40.2% without, even when we injected 40% false positives into CONTEST's output. Further, when using CONTEST, users corrected data entry errors 3.2 times faster than when using state-of-the-art methods. Copyright is held by the owner/author(s).","Continuous testing; Data debugging; Data testing","ACM SIGSOFT;et al.;Fujitsu;Huawei;IBM;Samsung","Association for Computing Machinery, Inc","24th International Symposium on Software Testing and Analysis, ISSTA 2015","13 July 2015 through 17 July 2015",,117924,"Conference Paper","Scopus"
